{
  "accepted": true,
  "baselines": {
    "declared_controls": [
      "Negative controls: constant, additive and dummy games beside exact SII and complete basis identities for four through eight players",
      "Constant, additive, signed pair, triple, four-way and dummy games",
      "Two proposals and 32 fixed iid streams with duplicate draws retained",
      "Zero-pair baseline and three shuffled-target predictors plus additive ridge",
      "Exact finite sampling variance, estimated SE squared and actual replicate MSE",
      "Constrained-rank diagnostics and finite boundary-penalty limit",
      "Actual shapiq 1.5.2 ExactComputer, SHAPIQ and KernelSHAPIQ",
      "Two editable plays and fresh source-only process refits"
    ],
    "expected_metrics": {
      "accepted": true,
      "actual_learner_passed": true,
      "audit_rows": 119,
      "author_reference_algorithms": 3,
      "author_reference_games": 7,
      "author_reference_passed": true,
      "author_reference_version": "1.5.2",
      "cached_model_inputs_used": false,
      "coalition_values": 487424,
      "cross_split_recipe_overlap": 0,
      "donor_predictions": 31195136,
      "embedded_figures": 10,
      "explanation_rows": 153,
      "fresh_compared_arrays": 663,
      "fresh_compared_elements": 118275724,
      "fresh_comparison": "exact_recursive_dtype_shape_value_sha256_including_container_order",
      "fresh_predictive_discovery": false,
      "fresh_reproduction_passed": true,
      "known_model_state_hashes_matched": 21,
      "logical_query_benchmark": true,
      "method_superiority_is_acceptance_gate": false,
      "model_fits": 7,
      "model_games": 1904,
      "native_model_retrained_in_this_report": true,
      "nested_draw_budgets": [
        16,
        32,
        64,
        128,
        256,
        512,
        1024
      ],
      "own_answer_code_cells": 22,
      "precomputed_oracle": true,
      "proposals": [
        "kernel",
        "uniform"
      ],
      "replicates_per_proposal": 32,
      "review_scope": "author_review_not_independent",
      "signed_pair_estimates": 47767552,
      "student_core_functions": 9,
      "student_method_exercises": 8,
      "test_count": 9,
      "tests_passed": true,
      "train_rows": 758
    }
  },
  "claim_scope": "Student-implemented SHAP-IQ and pairwise KernelSHAP-IQ on 1904 known model games, with complete query plans, replicate estimates, exact SII, finite sampling variance and controls. Logical query budgets use a precomputed oracle; no measured inference speedup, new predictive discovery or causal ingredient effects. Author review is not independent.",
  "datasets": [
    {
      "audit": 119,
      "explanation": 153,
      "id": "uci_concrete_compressive_strength",
      "license": "CC BY 4.0",
      "manifest": "data_manifest.json",
      "revision": "8d4b15b6fc68cd932d745cbd663d5ceae66dd54422e99c1e4865f2936ab7e2af",
      "source": "uci",
      "train": 758
    }
  ],
  "date_run": "2026-09-08T03:29:13+00:00",
  "evidence_level": "complete_native_pair_interaction_sampling_with_exact_games_and_author_package_checks",
  "git_commit": "ce96ceaa",
  "gpu_name": "unavailable",
  "gt_tier": "GT-0",
  "known_failures": [],
  "metrics": {
    "gpu_evidence": {
      "category": "cpu_or_budget_metric",
      "placeholder_only": false,
      "section_specific_metric_keys": [
        "actual_learner_passed",
        "audit_rows",
        "author_reference_algorithms",
        "author_reference_games",
        "author_reference_passed",
        "author_reference_version",
        "cached_model_inputs_used",
        "coalition_values",
        "cross_split_recipe_overlap",
        "donor_predictions",
        "embedded_figures",
        "explanation_rows",
        "first_constraint_error",
        "fresh_compared_arrays",
        "fresh_compared_elements",
        "fresh_comparison",
        "fresh_evidence_sha256",
        "fresh_output_directory",
        "fresh_predictive_discovery",
        "fresh_reproduction_passed",
        "known_model_state_hashes_matched",
        "learner_evidence_sha256",
        "logical_query_benchmark",
        "method_superiority_is_acceptance_gate",
        "model_fits",
        "model_games",
        "native_model_retrained_in_this_report",
        "nested_draw_budgets",
        "own_answer_code_cells",
        "pair_constraint_error",
        "precomputed_oracle",
        "proposals",
        "recipe_weighted_pair_mae_by_budget_and_model",
        "replicates_per_proposal",
        "review_scope",
        "signed_pair_estimates",
        "study",
        "train_rows"
      ],
      "uses_cuda": false
    },
    "gpu_test": {
      "actual_learner_passed": true,
      "audit_rows": 119,
      "author_reference_algorithms": 3,
      "author_reference_games": 7,
      "author_reference_passed": true,
      "author_reference_version": "1.5.2",
      "cached_model_inputs_used": false,
      "coalition_values": 487424,
      "cross_split_recipe_overlap": 0,
      "cuda_available": false,
      "cuda_version": "13.2",
      "device": "cpu",
      "donor_predictions": 31195136,
      "embedded_figures": 10,
      "explanation_rows": 153,
      "first_constraint_error": 4.263256414560601e-14,
      "fresh_compared_arrays": 663,
      "fresh_compared_elements": 118275724,
      "fresh_comparison": "exact_recursive_dtype_shape_value_sha256_including_container_order",
      "fresh_evidence_sha256": "d4d92e5c74c9ee94da3d23bce82af9f314603aa45bd18db5a00fd7ab8bdc2d3d",
      "fresh_output_directory": "/home/bitwise/.cache/arena_extended/shapiq_estimators/report_reproductions/report-xqkhcg5z/fresh_cpu",
      "fresh_predictive_discovery": false,
      "fresh_reproduction_passed": true,
      "gpu_total_memory_gb": null,
      "known_model_state_hashes_matched": 21,
      "learner_evidence_sha256": "f6a8823d6d583415256165f5fb6670150d758b9494a0a6add70702dce752fbb3",
      "logical_query_benchmark": true,
      "method_superiority_is_acceptance_gate": false,
      "model_fits": 7,
      "model_games": 1904,
      "native_model_retrained_in_this_report": true,
      "nested_draw_budgets": [
        16,
        32,
        64,
        128,
        256,
        512,
        1024
      ],
      "own_answer_code_cells": 22,
      "pair_constraint_error": 1.7053025658242404e-13,
      "peak_vram_gb": 0.0,
      "precomputed_oracle": true,
      "proposals": [
        "kernel",
        "uniform"
      ],
      "recipe_weighted_pair_mae_by_budget_and_model": {
        "kernel": {
          "kernelshap_iq": {
            "audit": [
              [
                2.4356104328411323,
                1.879008773655736,
                2.2731835930390387,
                6.276347420861107,
                6.886287673815238,
                7.156284512451373,
                7.90355215461509e-15
              ],
              [
                1.9282136650789687,
                1.5374685958760095,
                1.8352357972595068,
                5.241191316254891,
                5.466517872368698,
                6.049345471958177,
                8.778122674464735e-15
              ],
              [
                0.8836171547723211,
                0.696499628182226,
                0.833307626052092,
                2.4373642189501616,
                2.5012792334093352,
                2.751629308758824,
                4.410314951829273e-15
              ],
              [
                0.5099006811650552,
                0.41131563841272295,
                0.47833059976833014,
                1.435610044816027,
                1.4477033349877737,
                1.652357532732596,
                2.5963095900739595e-15
              ],
              [
                0.316478436919987,
                0.25624927892017,
                0.2982892642536724,
                0.9120757886246622,
                0.9147431541301305,
                1.0438577905303115,
                1.4743051949917735e-15
              ],
              [
                0.2225352652025187,
                0.1787183081971342,
                0.2099000555459832,
                0.6397427733636756,
                0.6352049826647675,
                0.7251127056574962,
                1.240800845167791e-15
              ],
              [
                0.14999421554468073,
                0.12064674524919108,
                0.1394549573903936,
                0.4276755381150757,
                0.428651703827378,
                0.4881160566748184,
                7.911227567579828e-16
              ]
            ],
            "explain": [
              [
                2.273840040840419,
                1.907584067914313,
                2.01369237429591,
                6.279708872765207,
                7.482540703310801,
                7.642572278251462,
                7.874112274992295e-15
              ],
              [
                1.8328083291621016,
                1.5499752447358421,
                1.670870713078728,
                5.162596481710045,
                5.878381180873617,
                6.253637461730648,
                9.136778378936993e-15
              ],
              [
                0.8428200886729258,
                0.6982303566196322,
                0.7544478413309883,
                2.429336243899407,
                2.683515559872892,
                2.8103205833792955,
                4.430577618067044e-15
              ],
              [
                0.494712686518376,
                0.40981861925742946,
                0.43854179646943287,
                1.4427716315671715,
                1.5441382934264545,
                1.662869530258541,
                2.6462840126881565e-15
              ],
              [
                0.3113278771447152,
                0.257691977038644,
                0.27679098482424247,
                0.9153713317705916,
                0.9713851439036345,